<?xml version="1.0" encoding="UTF-8"?>
<book xmlns:xsi="http://www.w3.org/2001/XMLSchema-instance"
    xsi:noNamespaceSchemaLocation="book.xsd">
    <title>Beginning XSL</title>
    <chapter>
        <title>Basic structure</title>
        <para>An XSLT consists of a stylesheet declaration and a set of templates.</para>
        <para>Do not forget: template elements must not be nested!</para>
    </chapter>
    <chapter>
        <title >Important elements</title>
        <para>Some more text.</para>
        <para>The first chapter explains basic structures.</para>
    </chapter>
</book>